27;AL;Nordeste;3120494;102;Secretaria de Estado da Assistencia e Desenvolvimento Social;Avenida;Comendador Calaca;1399;predio;poco;Predio da Antiga LBA;57025-640;MACEIO;AL;gabinete.seades.gov@gmail.com;(82) 33152878;;(82) 33151030;-9.6606588;-35.7273048;Secretaria estadual em conjunto com outras políticas setoriais;Não;Não;Não;Não;Sim;Não;Não;Não;;Sim, na estrutura formal do órgão gestor;Sim, na estrutura formal do órgão gestor;Sim, na estrutura formal do órgão gestor;Sim, de maneira informal;Sim, na estrutura formal do órgão gestor;Sim, na estrutura formal do órgão gestor;Sim, na estrutura formal do órgão gestor;Sim, na estrutura formal do órgão gestor;Sim, na estrutura formal do órgão gestor;Não;;;1;2011;;2012;;2;0;0;0;1;0;0;0;2;0;0;0;2;0;1;0;4;0;2;0;5;0;1;0;7;0;1;0;2;0;1;0;2;0;1;1;1;0;0;0;26;53;50;129;0;0;0;0;0;9;33;42;0;4;0;4;26;66;83;175;26;53;50;129;0;0;0;0;0;9;33;42;0;4;0;4;26;66;83;175;17;3;1;1;0;0;0;3;0;2;0;0;0;3;0;0;53;83;Não;;;;Não;;;;;Não;;;;;Sim, a totalidade dos recursos próprios é registrada no FEAS;O Secretário(a) Estadual da Assistência Social;Semestralmente;$1.067.194,35;$1.051.783,24;Não;Não;Não;Sim;Não;Não;Não;Não;Não;Sim;Não;Não;Não;Não;Sim;Sim;Não;;Não;;0;;;;;;Sim;Não;Não;Não;Sim;Cestas Nutricionais para gestantes;Não;;;Não;;;;;;;;;;;;;;;Não;;;;;;;;;;;;;;;;;;Sim;Sim;Sim;Sim;Não;Sim;Sim;Sim;Encontros intersetoriais;60;Sim, apenas fundo-a-fundo;Sim;O cofinanciamento é realizado por serviço socioassisentencial (PAIF, PAEFI, entre outros);;Não possui frequência regular;Sim;Sim;Não;Não;Não;Não;Não;68;68;0;50;50;0;40;40;0;0;0;0;0;0;0;2306500;0;6;5;1;4;2;0;1;1;0;0;1;0;Não;;Sim;Sim;Mensalmente;6;0;Sim;Não;Sim;12;Não;;Não;;Não;;Superintendente de Gestão da Informação;;Gerente de Monitoramento e Vigilância So
28;SE;Nordeste;2068017;75;Secretaria de Estado da Mulher, da lnclusão e Assistência Social, do Trabalho e dos Direitos Humanos;Rua;Santa Luzia;680;;São José;Próximo ao Procon.;49015-190;ARACAJU;SE;gabinete@inclusao.se.gov.br;(79) 31794836;;(79) 31797676;-10.916122;-37.051683;Secretaria estadual em conjunto com outras políticas setoriais;Não;Não;Não;Não;Sim;Sim;Sim;Sim;Mulher e Inclusão Produtiva;Sim, de maneira informal;Sim, de maneira informal;Sim, de maneira informal;Sim, de maneira informal;Sim, de maneira informal;Sim, de maneira informal;Sim, de maneira informal;Sim, de maneira informal;Sim, de maneira informal;Não;;;1;2015;;2012;;3;0;0;1;1;0;2;0;2;0;0;0;1;0;0;0;0;2;0;0;3;0;1;0;1;0;0;0;1;0;0;0;1;0;1;0;0;0;0;0;0;4;4;8;0;1;0;1;0;11;31;42;0;0;0;0;0;16;35;51;0;4;4;8;0;1;0;1;0;11;41;52;0;49;6;55;0;65;51;116;11;2;2;2;0;0;0;1;0;2;0;0;1;1;2;0;27;51;Não;;;;Não;;;;;Não;;;;;Sim, a maior parte dos recursos próprios é registrada no FEAS;O Secretário(a) Estadual da Assistência Social;Mensalmente;$21.621.400,00;$2.733.760,00;Não;Não;Não;Sim;Não;Não;Não;Não;Não;Sim;Sim;Não;Não;Sim;Não;Sim;Não;;Não;;0;;;;;;Não;;;;;;Não;;;Não;;;;;;;;;;;;;;;Sim;Sim;Não;Sim;Não;Não;Não;Não;Não;Não;Sim;2;Não;;0;;0;;Não;Sim;Sim;Sim;Não;Sim;Não;Não;;75;Sim, apenas fundo-a-fundo;Sim;O cofinanciamento é realizado por nível de proteção (Proteção Social Básica/Proteção Social Especial - Média ou Alta Com;;Não possui frequência regular;Não;Não;Sim;Não;Não;Sim;Sim, houve repasse de recursos aos municípios para construção e/ou reforma de unidades da assistência social;27;27;0;0;0;0;0;0;0;27;27;0;0;0;0;2733760;0;6;6;2;2;1;1;1;1;1;1;1;1;Sim;Sim;Sim;Não;Anualmente;1;0;Sim;Sim, para ambas;Não;;Não;;Não;;Não;;Gerente da Vigilância Socioassistencial;;GERENTE DA VIGILANCIA SOCIOASSISTENCIAL
29;BA;Nordeste;14016906;417;SECRETARIA DE JUSTIÇA, DIREITOS HUMANOS E DESENVOLVIMENTO SOCIAL;Avenida;LUIS VIANA FILHO;390;PLATAFORMA IV, 1º ANDAR;CENTRO ADMINISTRATIVO DA BAHIA;Prédio da Governadoria;41745-005;SALVADOR;BA;gabinete@sjdhds.ba.gov.br;(71) 31153168;0;(71) 00000000;-12.949565383526112;-38.43017578125001;Secretaria estadual em conjunto com outras políticas setoriais;Não;Não;Não;Não;Não;Não;Sim;Sim;Justiça e Desenvolvimento Social;Sim, na estrutura formal do órgão gestor;Sim, na estrutura formal do órgão gestor;Sim, na estrutura formal do órgão gestor;Sim, na estrutura formal do órgão gestor;Sim, na estrutura formal do órgão gestor;Sim, na estrutura formal do órgão gestor;Sim, na estrutura formal do órgão gestor;Sim, na estrutura formal do órgão gestor;Sim, na estrutura formal do órgão gestor;Não;;;1;2001;;2012;;7;10;3;26;6;0;0;0;2;0;0;0;1;0;0;0;10;0;5;0;6;0;1;0;5;0;2;0;3;0;3;0;2;0;4;0;1;0;0;0;2;7;13;22;0;0;0;0;0;11;28;39;1;0;0;1;3;18;41;62;2;10;13;25;0;0;0;0;1;11;35;47;4;3;0;7;7;24;48;79;14;6;5;2;0;3;0;2;0;1;0;0;0;5;0;0;10;48;Não;;;;Não;;;;;Não;;;;;Sim, a totalidade dos recursos próprios é registrada no FEAS;Outro Funcionário da Secretaria de Assistência Social;Semestralmente;$61.550.000,00;$53.988.355,04;Não;Não;Não;Sim;Não;Não;Não;Não;Não;Sim;Sim;Não;Não;Não;Não;Não;Sim;SCFV;Não;;0;;2;2;0;0;Não;;;;;;Não;;;Sim;Não;Sim;;9;Sim;Sim;Não;Não;Não;Sim;Sim;Sim;Não;;Não;;;;;;;;;;;;;;;;;;Sim;Sim;Sim;Sim;Sim;Sim;Sim;Sim;Videoaulas, Videoconferências;34;Sim, apenas fundo-a-fundo;Sim;O cofinanciamento é realizado por serviço socioassisentencial (PAIF, PAEFI, entre outros);;Não possui frequência regular;Sim;Sim;Sim;Sim;Não;Sim;Não;0;417;0;0;417;0;0;212;0;0;96;0;353;353;0;31771729;0;6;6;2;2;1;1;1;1;1;1;1;1;Não;;Sim;Sim;Mensalmente;11;1;Sim;Sim, para ambas;Não;;Não;;Não;;Não;;Coordenador II;;Coordenador II
31;MG;Sudeste;19597330;853;SUBSECRETARIA DE ESTADO DE ASSISTENCIA SOCIAL - SUBAS;Rodovia;Papa João Paulo II;4143;14º andar - Prédio Minas;SERRA VERDE;CIDADE ADMINISTRATIVA DO GOVERNO DE MINAS GERAIS;30630-900;BELO HORIZONTE;MG;simone.albuquerque@social.mg.gov.br;(31) 39168044;;(31) 39168044;-19.783453040182728;-43.952189683914185;Secretaria estadual em conjunto com outras políticas setoriais;Não;Não;Não;Não;Não;Sim;Não;Não;;Sim, na estrutura formal do órgão gestor;Sim, na estrutura formal do órgão gestor;Sim, na estrutura formal do órgão gestor;Sim, na estrutura formal do órgão gestor;Sim, na estrutura formal do órgão gestor;Sim, na estrutura formal do órgão gestor;Sim, na estrutura formal do órgão gestor;Sim, na estrutura formal do órgão gestor;Sim, na estrutura formal do órgão gestor;Sim;21;2011;;2013;;;1;8;62;6;7;8;62;1;7;11;62;0;7;0;62;0;7;6;62;7;7;6;62;0;7;6;62;0;7;6;62;0;7;4;62;0;7;4;62;0;7;8;26;113;147;2;9;4;15;0;8;53;61;0;7;9;16;10;50;179;239;8;26;113;147;2;19;19;40;0;8;56;64;0;8;13;21;10;61;201;272;57;37;10;16;0;11;0;1;0;4;0;0;2;10;7;0;46;201;Sim, para a maioria dos servidores;Do órgão responsável pelo planejamento;;2014;Não;;;;;Não;;;;;Sim, a totalidade dos recursos próprios é registrada no FEAS;O Secretário(a) Estadual da Assistência Social;Bimestralmente;$22.248.903,00;$8.145.989,26;Não;Não;Não;Sim;Sim;Não;Sim;Não;Não;Não;Não;Não;Não;Não;Sim;Não;Não;;Sim;Serviço de Proteção Especial Para Pessoas com Deficiência;1;Serviço de Acolhimento para Jovens e Adultos com Deficiência.;30;0;1;30;Não;;;;;;Não;;;Sim;Sim;Sim;3;4;Sim;Sim;Sim;Sim;Sim;Sim;Sim;Sim;Não;;Não;;;;;;;;;;;;;;;;;;Sim;Sim;Sim;Sim;Sim;Sim;Sim;Não;;165;Sim, apenas fundo-a-fundo;Sim;O cofinanciamento é comum a todos os serviços socioassistenciais;;Mensalmente;Sim;Sim;Sim;Sim;Sim;Sim;Não;853;853;0;853;853;0;853;853;0;853;853;0;853;853;0;28123501;0;6;6;2;2;1;1;1;1;1;1;1;1;Não;;Sim;Sim;Mensalmente;9;0;Sim;Sim, para ambas;Sim;17;Não;;Não;;Não;;Superintendente;;técnica de nível superior
32;ES;Sudeste;3514952;78;SECRETARIA DE ESTADO DE TRABALHO, ASSISTÊNCIA E DESENVOLVIMENTO SOCIAL;Rua;Dr João Carlos Souza;107;Ed Green Tower;Barro Vermelho;Rua da Divisão de Homicídios e Proteção à Pessoa DHPP, em frente ao MS Buffet;29057-530;VITORIA;ES;gabinete@setades.es.gov.br;(27) 36366821;6824;(27) 36366822;-20.29242880224181;-40.29878325337302;Secretaria estadual em conjunto com outras políticas setoriais;Não;Não;Não;Não;Não;Sim;Não;Não;;Sim, na estrutura formal do órgão gestor;Sim, na estrutura formal do órgão gestor;Sim, de maneira informal;Não constituída;Sim, na estrutura formal do órgão gestor;Sim, na estrutura formal do órgão gestor;Sim, na estrutura formal do órgão gestor;Sim, de maneira informal;Sim, na estrutura formal do órgão gestor;Não;;2012;;;1;2014;;6;0;0;0;2;0;0;0;1;0;0;0;0;0;0;0;2;0;0;0;7;0;1;0;0;7;0;1;0;7;0;1;1;1;0;1;6;1;1;1;1;0;25;26;0;0;0;0;1;18;32;51;0;0;16;16;2;18;73;93;1;0;25;26;0;0;0;0;1;18;32;51;0;0;16;16;2;18;73;93;34;3;5;1;0;0;0;7;0;6;0;0;0;10;0;0;7;73;Sim, para a minoria dos servidores;Centralizado no governo;;2013;Não;;;;;Não;;;;;Sim, a maior parte dos recursos próprios é registrada no FEAS;O Secretário(a) Estadual da Assistência Social;Semestralmente;$49.054.268,41;$40.553.844,90;Não;Não;Não;Sim;Não;Não;Não;Não;Não;Sim;Não;Não;Não;Não;Sim;Sim;Não;;Não;;0;;;;;;Não;;;;;;Sim;12948;948378;Não;;;;;;;;;;;;;;;Não;;;;;;;;;;;;;;;;;;Não;Não;Sim;Sim;Não;Sim;Sim;Sim;Assessoramento técnico de forma presencial na sede da Secretaria.;78;Sim, apenas fundo-a-fundo;Sim;O cofinanciamento é realizado por nível de proteção (Proteção Social Básica/Proteção Social Especial - Média ou Alta Com;;Trimestralmente;Sim;Sim;Sim;Sim;Não;Sim;Não;78;78;0;78;78;0;73;73;0;62;62;0;78;78;0;28804084;0;3;3;2;2;1;1;1;1;1;1;1;1;Sim;Sim;Sim;Sim;Mensalmente;8;0;Não;Sim, para ambas;Não;;Não;;Não;;Não;;Gerente de Gestão do SUAS;;Coordenador
33;RJ;Sudeste;15989929;92;Secretaria de Estado de Ciência, Tecnologia, Inovação e Desenvolvimento Social do Rio de Janeiro;Avenida;Erasmo Braga;118;9º andar;Centro;Ao lado da ALERJ;20020-000;RIO DE JANEIRO;RJ;ssasdg@gmail.com;(21) 23326378;;(21);-22.904710137401512;-43.17391991615296;Secretaria estadual em conjunto com outras políticas setoriais;Não;Não;Não;Não;Não;Não;Não;Sim;Ciência e Tecnologia;Sim, de maneira informal;Sim, de maneira informal;Sim, de maneira informal;Sim, de maneira informal;Sim, de maneira informal;Sim, na estrutura formal do órgão gestor;Sim, na estrutura formal do órgão gestor;Sim, de maneira informal;Sim, de maneira informal;Não;;;1;2016;;2016;;0;5;0;0;0;5;0;0;0;5;0;0;0;5;0;0;0;5;0;0;4;1;0;0;0;5;1;0;0;5;0;1;3;0;1;0;0;1;0;0;1;10;18;29;0;0;0;0;26;99;81;206;0;0;0;0;27;109;99;235;1;10;18;29;0;0;0;0;36;104;82;222;0;0;0;0;37;114;100;251;22;3;2;21;1;0;0;7;0;1;0;0;0;4;1;2;36;100;Não;;;;Não;;;;;Não;;;;;Sim, a totalidade dos recursos próprios é registrada no FEAS;O Secretário(a) Estadual da Assistência Social;Anualmente;$449.253.374,00;$157.344.242,00;Não;Não;Não;Sim;Não;Não;Não;Sim;Não;Não;Sim;Não;Não;Não;Não;Não;Não;;Não;;1;Abrigos;3;0;0;3;Não;;;;;;Não;;;Não;;;;;;;;;;;;;;;Não;;;;;;;;;;;;;;;;;;Sim;Sim;Sim;Sim;Sim;Sim;Sim;Sim;Atendimento telefônico, email, Encontros Regionais e presenciais na própria secretaria.;6;Sim, apenas fundo-a-fundo;Sim;Outra organização;PSB e PSE;Trimestralmente;Sim;Sim;Sim;Sim;Sim;Sim;Não;92;92;0;92;92;0;85;85;0;85;85;0;68;68;0;12636640;0;6;6;2;2;1;1;1;1;1;1;1;1;Não;;Não;Sim;Mensalmente;8;0;Sim;Não;Não;;Não;;Não;;Não;;Superintendente de Gestão do SUAS;;Assessor Técnico
35;SP;Sudeste;41262199;645;Secretaria de Estado de Desenvolvimento Social;Rua;BELA CINTRA;1032;não há;CONSOLAÇÃO;Próximo à Avenida Paulista;01415-000;SAO PAULO;SP;florianopesaro@sp.gov.br;(11) 27638000;0;(11) 27638255;-23.555808814285406;-46.661574840545654;Secretaria estadual em conjunto com outras políticas setoriais;Não;Não;Não;Não;Não;Não;Não;Sim;Políticas sobre Drogas e 2 Programas de Segurança Alimentar e Nutricional;Sim, na estrutura formal do órgão gestor;Sim, na estrutura formal do órgão gestor;Sim, de maneira informal;Não constituída;Sim, na estrutura formal do órgão gestor;Sim, de maneira informal;Sim, de maneira informal;Sim, de maneira informal;Sim, de maneira informal;Sim;26;;1;2016;;2016;;3;4;0;0;11;4;2;0;11;0;1;0;0;0;0;0;27;0;3;0;3;1;0;0;0;9;0;1;0;9;0;1;0;2;0;0;0;1;0;0;2;38;229;269;0;0;0;0;0;29;211;240;3;8;32;43;5;75;472;552;2;38;229;269;0;0;0;0;0;29;211;240;3;8;32;43;5;75;472;552;101;75;50;27;0;34;0;12;0;5;1;0;2;55;0;0;110;472;Não;;;;Não;;;;;Não;;;;;Sim, a maior parte dos recursos próprios é registrada no FEAS;Outro Funcionário da Secretaria de Assistência Social;Bimestralmente;$260.431.835,00;$222.407.697,76;Não;Não;Não;Sim;Não;Não;Não;Não;Não;Sim;Não;Não;Não;Não;Sim;Não;Não;;Não;;1;Serviço de acolhimento institucional nas modalidades de abrigo, residência inclusiva e casa de passagem;11;0;0;11;Não;;;;;;Sim;69006;6024740;Não;;;;;;;;;;;;;;;Sim;Não;Não;Não;Sim;Não;Não;Não;Não;Não;;;;;;;;;Não;Sim;Sim;Sim;Sim;Sim;Sim;Sim;Reuniões temáticas específicas com grupos de municípios com participação de técnicos dos órgãos gestores municipais e/ou técnicos de CRAS e/ou técnicos de CREAS e/ou conselheiros municipais. Coordenação do Grupo de Estudo e Capacitação Continuada de Trabalhadores do SUAS ? GECCATS de Franca.;562;Sim, ambos;Sim;O cofinanciamento é realizado por nível de proteção (Proteção Social Básica/Proteção Social Especial - Média ou Alta Com;;Mensalmente;Sim;Sim;Sim;Sim;Não;Sim;Não;644;644;36;631;631;34;353;353;2;331;331;0;6;6;0;199338284;6821890;6;6;2;2;1;1;1;1;1;1;1;1;Não;;Sim;Sim;Quadrimestralmente;4;0;Sim;Sim, para ambas;Não;;Sim;10;Não;;Sim;83;Diretor Técnico III;;Coordenador de Gestão Estratégica
41;PR;Sul;10444526;399;Secretaria de Estado da Família e Desenvolvimento Social - SEDS;Rua;JACY LOUREIRO CAMPOS;0;PALACIO DAS ARAUCÁRIAS;CENTRO CÍVICO;;80530-915;CURITIBA;PR;gabinete@seds.pr.gov.br;(41) 32102400;2711;(41);-25.414923434786722;-49.27002042531968;Secretaria estadual exclusiva da área de Assistência Social;;;;;;;;;;Sim, na estrutura formal do órgão gestor;Sim, de maneira informal;Sim, de maneira informal;Não constituída;Sim, na estrutura formal do órgão gestor;Sim, na estrutura formal do órgão gestor;Sim, na estrutura formal do órgão gestor;Sim, de maneira informal;Sim, de maneira informal;Sim;22;2013;;2016;;2016;;6;2;1;0;0;0;0;0;0;0;0;0;0;0;0;0;8;0;3;0;0;13;0;1;5;5;0;0;7;5;2;0;0;0;0;1;0;0;0;1;9;18;125;152;0;0;0;0;0;32;117;149;0;0;50;50;9;50;292;351;9;18;125;152;0;0;0;0;0;32;117;149;0;0;50;50;9;50;292;351;100;40;27;21;0;1;0;5;1;7;0;0;0;26;0;0;64;292;Sim, para a totalidade dos servidores;Centralizado no governo;;2006;Não;;;;;Não;;;;;Sim, a totalidade dos recursos próprios é registrada no FEAS;Outro Funcionário da Secretaria de Assistência Social;Mensalmente;$83.897.068,00;$66.522.222,20;Não;Não;Não;Sim;Não;Não;Não;Não;Não;Sim;Não;Não;Não;Não;Sim;Não;Não;;Não;;1;10;10;0;0;10;Não;;;;;;Não;;;Sim;Não;Sim;;24;Sim;Sim;Sim;Sim;Sim;Sim;Sim;Sim;Não;;Sim;Não;Não;Não;Sim;Não;Não;Não;Não;Não;;;;;;;;;Sim;Sim;Sim;Sim;Sim;Sim;Sim;Não;;399;Sim, ambos;Sim;Outra organização;Geral e Específico;Trimestralmente;Sim;Sim;Sim;Sim;Sim;Sim;Sim, houve repasse de recursos aos municípios para construção e/ou reforma de unidades da assistência social;340;317;23;171;171;0;63;40;23;106;106;0;173;173;0;29180537;16200;6;6;2;2;1;1;1;1;1;1;1;1;Sim;Sim;Sim;Sim;Mensalmente;7;0;Sim;Sim, para ambas;Não;;Não;;Não;;Não;;Superintendente da Assistencia Social;;Coordenador de Gestão do SUAS
42;SC;Sul;6248436;295;Secretaria de Estado da Assistência Social Trabalho e Habitação;Avenida;Mauro Ramos;722;;Centro;;88020-300;FLORIANOPOLIS;SC;gabinete@sst.sc.gov.br;(48) 36640800;722;(48) 36640615;-27.595345259204702;-48.54326248168945;Secretaria estadual em conjunto com outras políticas setoriais;Não;Não;Não;Sim;Sim;Sim;Sim;Não;;Sim, na estrutura formal do órgão gestor;Sim, na estrutura formal do órgão gestor;Sim, na estrutura formal do órgão gestor;Sim, na estrutura formal do órgão gestor;Sim, na estrutura formal do órgão gestor;Sim, na estrutura formal do órgão gestor;Sim, na estrutura formal do órgão gestor;Sim, na estrutura formal do órgão gestor;Sim, na estrutura formal do órgão gestor;Não;;;1;2017;;2017;;0;2;0;0;2;0;0;0;3;0;0;0;0;1;0;0;3;3;0;0;4;0;0;0;3;1;0;0;0;1;0;0;1;1;0;0;2;1;0;0;0;16;35;51;0;0;0;0;0;9;16;25;0;0;2;2;0;25;53;78;0;16;35;51;0;0;0;0;0;9;16;25;0;0;2;2;0;25;53;78;14;4;5;6;0;1;0;3;0;2;0;0;0;9;0;0;9;53;Sim, para a totalidade dos servidores;Centralizado no governo;;1993;Não;;;;;Não;;;;;Sim, a maior parte dos recursos próprios é registrada no FEAS;O Secretário(a) Estadual da Assistência Social;Semestralmente;$55.716.913,00;$22.113.965,29;Não;Não;Não;Sim;Não;Não;Não;Não;Não;Sim;Sim;Não;Não;Não;Não;Sim;Não;;Não;;0;;;;;;Não;;;;;;Sim;28422;948088;Não;;;;;;;;;;;;;;;Não;;;;;;;;;;;;;;;;;;Sim;Sim;Sim;Sim;Sim;Sim;Sim;Não;;16;Sim, apenas fundo-a-fundo;Não;O cofinanciamento é realizado por nível de proteção (Proteção Social Básica/Proteção Social Especial - Média ou Alta Com;;Anualmente;Sim;Sim;Sim;Sim;Não;Não;Sim, houve construção e/ou reforma direta pelo estado de unidades da assistência social nos municípios;263;263;0;263;263;0;1;1;0;0;0;0;0;0;0;7901490;0;6;6;2;2;1;1;1;1;1;1;1;1;Sim;Sim;Sim;Sim;Bimestralmente;6;4;Sim;Sim, para ambas;Não;;Não;;Não;;Não;;Assistente Social / Gerente;;Assistente Social / Gerente
43;RS;Sul;10693929;497;Secretaria de Desenvolvimento Social, Trabalho, Justiça e Direitos Humanos;Avenida;Av. Borges de Medeiros;1501;8º andar;Centro;Centro Administrativo do Estado do Rio Grande do Sul;90119-900;PORTO ALEGRE;RS;das@sdstjdh.rs.gov.br;(51) 32886400;6521;(51) 32886526;-30.040752183293456;-51.23105049133301;Secretaria estadual em conjunto com outras políticas setoriais;Não;Não;Sim;Não;Sim;Sim;Sim;Sim;Justiça;Sim, de maneira informal;Sim, de maneira informal;Sim, de maneira informal;Não constituída;Sim, de maneira informal;Sim, de maneira informal;Sim, de maneira informal;Sim, de maneira informal;Não constituída;Não;;;1;2007;;;1;0;0;0;0;0;4;0;0;0;4;0;0;0;0;0;0;2;0;0;0;2;6;0;0;1;3;0;0;0;4;0;0;3;0;1;0;0;0;0;0;0;1;34;35;0;0;0;0;0;1;2;3;0;0;0;0;0;2;36;38;0;1;34;35;0;0;0;0;0;1;2;3;0;0;0;0;0;2;36;38;33;0;1;0;0;1;0;0;0;0;0;0;0;1;0;0;0;36;Não;;;;Não;;;;;Não;;;;;Sim, a totalidade dos recursos próprios é registrada no FEAS;O Secretário(a) Estadual da Assistência Social;Semestralmente;$0,00;$4.700.000,00;Não;Não;Não;Sim;Não;Não;Não;Não;Não;Sim;Não;Não;Não;Não;Sim;Sim;Não;;Não;;0;;;;;;Não;;;;;;Não;;;Não;;;;;;;;;;;;;;;Não;;;;;;;;;;;;;;;;;;Sim;Sim;Não;Sim;Não;Sim;Sim;Sim;E-mail e telefone;260;Sim, apenas fundo-a-fundo;Sim;O cofinanciamento é realizado por nível de proteção (Proteção Social Básica/Proteção Social Especial - Média ou Alta Com;;Anualmente;Sim;Sim;Não;Não;Não;Não;Não;482;482;0;482;482;0;74;74;0;0;0;0;0;0;0;47000;0;3;3;2;2;1;1;1;1;0;0;1;1;Sim;Sim;Sim;Sim;Mensalmente;10;0;Sim;Sim, para ambas;Sim;8;Não;;Sim;445;Não;;Diretora do Departamento;;Tecnico Cientifico
50;MS;Centro-Oeste;2449024;79;SECRETARIA DE ESTADO DE DIREITOS HUMANOS, ASSISTÊNCIA SOCIAL E TRABALHO;Avenida;DESEMBARGADOR JOSÉ NUNES DA CUNHA, BLOCO III;0;;JARDIM VERANEIO;;79031-310;CAMPO GRANDE;MS;sedhast@sedhast.ms.gov.br;(67) 33184100;4141;(67) 33184111;-20.452397524718727;-54.55361008644104;Secretaria estadual em conjunto com outras políticas setoriais;Não;Não;Não;Não;Não;Sim;Sim;Não;;Sim, na estrutura formal do órgão gestor;Sim, na estrutura formal do órgão gestor;Sim, na estrutura formal do órgão gestor;Sim, de maneira informal;Sim, na estrutura formal do órgão gestor;Sim, na estrutura formal do órgão gestor;Sim, na estrutura formal do órgão gestor;Sim, na estrutura formal do órgão gestor;Sim, de maneira informal;Não;;2016;;2016;;2016;;111;69;97;92;5;0;0;0;18;2;8;0;0;0;0;0;0;27;0;13;21;0;8;0;0;0;0;0;27;0;95;0;5;0;0;0;16;0;8;0;3;144;73;220;0;0;5;5;0;11;52;63;0;0;0;0;3;155;130;288;349;361;183;893;8;34;6;48;0;115;194;309;0;463;0;463;357;973;383;1713;60;27;75;11;1;1;1;2;0;1;0;0;0;15;1;0;188;383;Sim, para a totalidade dos servidores;Do próprio órgão gestor da Assistência Social;;2016;Não;;;;;Não;;;;;Sim, a menor parte dos recursos próprios é registrada no FEAS;O Secretário(a) Estadual da Assistência Social;Bimestralmente;$189.696.800,00;$154.387.091,30;Não;Não;Não;Sim;Não;Não;Não;Não;Não;Sim;Sim;Não;Não;Não;Não;Não;Sim;Chamamento Publico 1,2,4;Sim;Chamamento Publico 1;1;Chamamento Publico 1;38;16;14;8;Não;;;;;;Sim;39695;6748150;Sim;Não;Sim;;4;Sim;Sim;Sim;Sim;Sim;Sim;Sim;Sim;Não;;Sim;Não;Não;Não;Sim;Sim;Não;Não;Não;Não;;;;;;;;;Sim;Sim;Sim;Sim;Sim;Sim;Sim;Não;;79;Sim, apenas fundo-a-fundo;Sim;Outra organização;Até 30% Benefícios Eventuais e o restante preferencialmente para PSE;Mensalmente;Sim;Sim;Sim;Sim;Não;Sim;Não;79;79;0;79;79;0;79;79;0;79;79;0;79;79;0;13488260;6365182;6;6;2;2;1;2;1;0;1;1;1;1;Sim;Sim;Sim;Sim;Mensalmente;11;0;Sim;Sim, para ambas;Sim;26;Não;;Sim;474;Não;;Superintendente;;Coordenadora
51;MT;Centro-Oeste;3035122;141;SECRETARIA DE ESTADO DE TRABALHO E ASSISTENCIA SOCIAL;Rua;JOÃO DOMINGOS DE CAMPOS;100;;CENTRO POLITICO ADMINISTRATIVO;;78049-931;CUIABA;MT;saas@setas.mt.gov.br;(65) 36135711;;(65);-15.596;-56.097;Secretaria estadual em conjunto com outras políticas setoriais;Não;Não;Não;Não;Não;Sim;Não;Não;;Sim, na estrutura formal do órgão gestor;Sim, na estrutura formal do órgão gestor;Não constituída;Não constituída;Não constituída;Sim, na estrutura formal do órgão gestor;Sim, na estrutura formal do órgão gestor;Sim, na estrutura formal do órgão gestor;Não constituída;Não;;;1;;1;2017;;9;0;13;0;2;0;0;2;6;0;1;0;0;0;0;0;1;0;1;0;11;0;1;0;8;0;1;0;2;0;5;1;6;0;5;1;0;1;0;0;24;58;90;172;0;0;3;3;0;52;0;52;0;0;0;0;24;110;93;227;39;200;109;348;0;0;3;3;0;63;0;63;0;4;0;4;39;267;112;418;40;17;9;2;0;0;0;9;0;8;0;0;0;15;0;0;12;112;Sim, para a totalidade dos servidores;Centralizado no governo;;2014;Não;;;;;Não;;;;;Sim, a menor parte dos recursos próprios é registrada no FEAS;O Secretário(a) Estadual da Assistência Social;Mensalmente;$6.105.075,38;$6.105.075,38;Não;Não;Não;Sim;Não;Não;Não;Não;Não;Sim;Sim;Não;Não;Não;Não;Sim;Não;;Não;;0;;;;;;Não;;;;;;Sim;2526;252600;Não;;;;;;;;;;;;;;;Não;;;;;;;;;;;;;;;;;;Sim;Sim;Não;Sim;Não;Sim;Não;Não;;13;Sim, apenas fundo-a-fundo;Sim;O cofinanciamento é comum a todos os serviços socioassistenciais;;Anualmente;Sim;Sim;Sim;Sim;Sim;Não;Não;141;141;0;141;141;0;141;141;0;141;141;0;141;141;0;6105075;6105075;6;6;2;2;1;1;1;1;1;1;1;1;Sim;Sim;Sim;Sim;Bimestralmente;5;0;Sim;Sim, somente fornece ajuda de custo para participação nas conferências estaduais;Não;;Não;;Não;;Não;;Secretário Adjunto de Assistência Social;;Gerente da Vigilância Socioassistencial
52;GO;Centro-Oeste;6003788;246;SECRETARIA DE ESTADO DA MULHER, DO DESENVOLVIMENTO SOCIAL, DA IGUALDADE RACIAL, DOS DIREITOS HUMANOS E DO TRABALHO;Avenida;UNIVERSITÁRIA;609;000;LESTE UNIVERSITARIO;EM FRENTE À SANEAGO;74605-010;GOIANIA;GO;sgsuas@cidadania.goias.gov.br;(62) 32018522;8505;(62);-16.67570315382217;-49.23793315887452;Secretaria estadual em conjunto com outras políticas setoriais;Não;Não;Não;Não;Não;Sim;Sim;Sim;Mulher e Igualdade Racial;Sim, na estrutura formal do órgão gestor;Sim, de maneira informal;Sim, de maneira informal;Não constituída;Sim, na estrutura formal do órgão gestor;Sim, de maneira informal;Sim, de maneira informal;Sim, de maneira informal;Sim, de maneira informal;Não;;2015;;2007;;2015;;3;0;3;0;4;0;0;0;2;0;3;0;0;0;0;0;0;9;9;0;3;0;2;0;1;0;1;0;0;0;0;0;5;0;1;0;1;0;0;0;1;13;25;39;0;1;3;4;1;6;2;9;0;0;0;0;2;20;30;52;74;697;606;1377;3;1;3;7;20;72;38;130;0;0;0;0;97;770;647;1514;140;78;118;6;1;9;4;25;1;5;0;5;25;72;26;48;84;647;Sim, para a totalidade dos servidores;Do próprio órgão gestor da Assistência Social;;2010;Não;;;;;Não;;;;;Sim, a totalidade dos recursos próprios é registrada no FEAS;O Secretário(a) Estadual da Assistência Social;Bimestralmente;$0,00;$0,00;Não;Sim;Não;Não;Não;Não;Não;Sim;Não;Não;Sim;Não;Não;Não;Não;Não;Sim;Serviço de convivência e fortalecimento de vínculos;Sim;PS a adolescentes em cumprimento de medidas socioeducativas (LA e PSC);1;Acolhimento Institucional para crianças, adolescente e idosos;487;333;10;144;Não;;;;;;Sim;70000;6600000;Não;;;;;;;;;;;;;;;Não;;;;;;;;;;;;;;;;;;Não;Não;Não;Sim;Não;Sim;Sim;Não;;104;Sim, apenas fundo-a-fundo;Sim;O cofinanciamento é realizado por nível de proteção (Proteção Social Básica/Proteção Social Especial - Média ou Alta Com;;Mensalmente;Sim;Sim;Não;Sim;Não;Não;Não;0;0;0;0;0;0;0;0;0;0;0;0;0;0;0;0;0;6;6;2;2;1;1;1;1;1;1;1;1;Sim;Sim;Sim;Sim;Mensalmente;4;0;Sim;Sim, para ambas;Não;;Não;;Não;;Não;;Superintendente de Gestão do SUAS;1;
